{
  "registry_file": "model-registry.json",
  "registry_version": "2026.10.2",
  "sha256": "dedff0e5a9c7fceb20c5f1798467bb80f79b381863fea832566b84039b07ac0f",
  "signature_format": "cms-detached",
  "signature_file": "model-registry.json.p7s",
  "signer": {
    "identity": "Developer ID Application: Charles Seay (7NSS5CJL9E)",
    "team_id": "7NSS5CJL9E",
    "certificate_sha256": "0000000000000000000000000000000000000000000000000000000000000000"
  },
  "signed_at": "2026-10-19T12:00:00Z",
  "status": "example-unsigned"
}
